{
  "artifacts": [
    {
      "artifact_id": "artifact:5e9b349b67e2820b97ae161d",
      "content_digest": "sha256:0a890ce2d184f4d5baec5d155169fc53c98cdfa4aa5c60649d5a362cc66d1422",
      "created_at": "2026-08-10T10:06:00.903597+00:00",
      "media_type": "text/plain",
      "producer": "synthetic-evaluator",
      "redaction_status": "public-safe",
      "relative_path": "trace.txt",
      "size": 198,
      "snapshot_id": "fixture-v1"
    },
    {
      "artifact_id": "artifact:c2a9f28f22aad6b0f62dede8",
      "content_digest": "sha256:b967e800f09e947adc816354635946c9fbe64481aa9581dd8acc563d2fe2e02e",
      "created_at": "2026-08-10T10:06:00.908620+00:00",
      "media_type": "text/plain",
      "producer": "synthetic-evaluator",
      "redaction_status": "public-safe",
      "relative_path": "verification.txt",
      "size": 176,
      "snapshot_id": "fixture-v1"
    }
  ],
  "case_id": "eval-evm-001",
  "created_at": "2026-08-10T10:06:30.396471+00:00",
  "producer": "synthetic-evaluator",
  "schema_version": "1.0",
  "snapshot_id": "fixture-v1"
}
